{
  "id": "019c5c87-5e41-739d-b6fa-4fe7b98c7c00",
  "name": "caspian",
  "display": "Caspian the Fox",
  "owner": "CaspianTheFox",
  "repo": "furchain-caspian",
  "path": "characters/caspian",
  "fingerprint": "sha256:46f07b49845465d9f5b23ef3ad4e42093f79343009136ea4a2e9aec647b9654e",
  "registered": "2026-02-14T14:25:05.298Z"
}
