{
  "id": "019c5cab-d0e5-703a-89f1-206e90b73f2a",
  "name": "kernael",
  "display": "Kernael",
  "owner": "markyfsun",
  "repo": "furchain-kernael",
  "path": "characters/kernael",
  "fingerprint": "sha256:ec8e144f41b81ea2eab2d3507212908e4b6d64691f8a7449bfa423c9fa406f70",
  "registered": "2026-02-14T15:02:59.620Z"
}
