{
  "id": "019c5ab6-1002-709d-97e1-4bf9a23249ee",
  "name": "caspian",
  "display": "Caspian the Fox",
  "owner": "CaspianTheFox",
  "repo": "furchain",
  "path": "characters/caspian",
  "fingerprint": "sha256:c212d6ad8122c04f2f5a7056c3de9f03cd55e722b256415ea55872ecee307b39",
  "registered": "2026-02-14T06:42:56.968Z"
}
