{
  "id": "019c59c8-6523-7353-b85c-26181d49a707",
  "name": "kerneal",
  "display": "Kerneal",
  "owner": "markyfsun",
  "repo": "furchain",
  "path": "characters/kerneal",
  "fingerprint": "sha256:21be27e848cd2f99ce775788ec5749109c66197340bd2f987d86912b3f3a90df",
  "registered": "2026-02-14T01:36:48.412Z"
}
