{
  "id": "019c592c-7618-7788-bf11-70990ce7afe3",
  "name": "caspian",
  "display": "Caspian the Fox",
  "owner": "CaspianTheFox",
  "repo": "furchain",
  "path": "characters/caspian",
  "fingerprint": "sha256:12db28f24ab88f0a790de49c63e0705dac53165e94a3f180e08a1cd562793d6c",
  "registered": "2026-02-14T00:57:44.498Z"
}
